<?xml version="1.0"?>
<?xml-stylesheet type="text/xsl" href="utenti.xslt"?>
<utenti xmlns="http://www.utenti.com"
  xmlns:xs="http://www.w3.org/2001/XMLSchema-instance"
  xs:schemaLocation="http://www.utenti.com utenti.xsd">
  <user>
    <username>Nate</username>
    <password>gecko</password>
    <registrationDate>2014-11-01</registrationDate>
  </user>
  <user>
    <username>John Reese</username>
    <password>koala</password>
    <registrationDate>2010-05-24</registrationDate>
  </user>
</utenti>
